name,area_name,salary_from,salary_to,salary_currency,published_at,employer_name,requirement,schedule_id,working_hours_id,work_schedule_by_days,professional_roles,experience_name,employment_id
Webmaster,Алматы,,,,2024-12-16T20:58:36+0300,"Velvetech, LLC",Proven work experience as a WordPress Developer or similar role. Experience in managing content publication and configuring websites through CMS...,fullDay,HOURS_4,5/2,"Программист, разработчик",От 3 до 6 лет,part
DevOps-инженер,Алматы,,,,2024-12-17T11:34:46+0300,My Startups,"Способен быстро разбираться в новых технологиях и инструментах, постоянно следишь за трендами в области <highlighttext>DevOps</highlighttext>. - Имеешь опыт работы с базами...",fullDay,HOURS_8,5/2,DevOps-инженер,От 3 до 6 лет,full
Ведущий инженер (системный аналитик),Астана,,550000.0,KZT,2024-11-28T15:56:13+0300,Национальные информационные технологии,"Опыт в написании технической документации (ТЗ, инструкции, спецификации). Опыт взаимодействия с кросс-функциональными командами (разработчики, QA, аналитики, <highlighttext>DevOps</highlighttext>).",fullDay,HOURS_8,5/2,"BI-аналитик, аналитик данных",От 1 года до 3 лет,full
Python Backend Developer,Алматы,,,,2024-11-22T17:05:23+0300,oitech,"Опыт: 3+ лет в разработке на Python (production опыт). Технологии: Отличное знание Python (Django, Flask, FastAPI), опыт работы с...",fullDay,HOURS_8,5/2,"Программист, разработчик",От 3 до 6 лет,full
"Senior Data Engineer (Python, Spark, SQL)",Алматы,,,,2024-12-17T13:58:25+0300,tny.,"Advanced level English. Azure data factory, AWS Glue, Airflow. <highlighttext>DevOps</highlighttext> experience. Experience with low-code ETL tools like Dagster, Stitch...",remote,FLEXIBLE,Свободный,"Программист, разработчик",От 3 до 6 лет,full
DevOps администратор на проект,Алматы,,,,2024-12-10T15:10:33+0300,Southbridge,Опыт работы с GitLab CI для автоматизации процессов CI/CD. — Опыт работы с Ansible/Puppet/Chef для конфигурационного управления и...,remote,HOURS_4,5/2,DevOps-инженер,От 1 года до 3 лет,part
DevOps Engineer,Алматы,,,,2024-12-06T11:01:20+0300,MYTONA KZ,Опыт работы в качестве <highlighttext>DevOps</highlighttext> от 2-х лет. Опыт работы с Kubernetes и Docker. Знание Helm и умение писать...,remote,HOURS_8,5/2,DevOps-инженер,От 1 года до 3 лет,full
Технический архитектор,Астана,1000000.0,,KZT,2024-12-11T13:30:06+0300,Networks Energy,"Опыт работы с базами данных (SQL, NoSQL). - Знание <highlighttext>DevOps</highlighttext>-практик, CI/CD, контейнеризации (Docker, Kubernetes). - Опыт работы с инструментами мониторинга...",fullDay,HOURS_8,5/2,Директор по информационным технологиям (CIO),Более 6 лет,full
Backend Developer (Django),Алматы,450000.0,700000.0,KZT,2024-11-22T14:00:22+0300,Бекхожаев К.Т,...работы с проектами для социальных сетей или приложений знакомств. Понимание принципов разработки масштабируемых систем с высокой нагрузкой. Знание <highlighttext>DevOps</highlighttext>-подходов.,fullDay,HOURS_8,5/2,"Программист, разработчик",От 3 до 6 лет,full
Junior+ Node.js разработчик,Алматы,,120000.0,RUR,2024-12-03T08:50:28+0300,Ботхаб,"Глубокие знания JavaScript (ES6), TypeScript, Node.js и Express от 1 года реального коммерческого опыта (проверяется качество проектов, знания на...",remote,HOURS_8,5/2,"Программист, разработчик",Нет опыта,full
Senior DevOps Инженер,Алматы,,,,2024-12-16T14:49:54+0300,XCloud Labs LTD,Опыт работы в <highlighttext>DevOps</highlighttext> не менее 4 лет. Опыт работы с Kubernetes и Docker. Знание Linux и понимание концепций сетевой...,remote,HOURS_8,5/2,DevOps-инженер,От 3 до 6 лет,full
DevOps-инженер,Астана,,,,2024-12-15T09:23:16+0300,DauInvest,Опыт работы с Linux системами и их администрированием. Уверенные знания в настройке и управлении веб-серверами Nginx. Опыт работы с...,fullDay,HOURS_8,5/2,DevOps-инженер,От 3 до 6 лет,full
Tech Lead,Алматы,,,,2024-12-17T15:30:28+0300,Частная компания Snoonu Technologies Ltd.,"Knowledge of async operations and distributed transactions principles. Familiarity with Agile, <highlighttext>DevOps</highlighttext>, Microservices, IaC, and Code Review principles. ",remote,HOURS_8,5/2,"Программист, разработчик",Более 6 лет,full
Системный администратор,Алматы,,,,2024-12-16T12:41:44+0300,Freedom Media,"Наличие сертификатов будет существенным плюсом. Будет преимуществом базовые знания <highlighttext>Devops</highlighttext>, Английский B1. Ты будешь работать с инновационной платформой, которая...",fullDay,HOURS_8,5/2,Системный администратор,От 3 до 6 лет,full
Системный аналитик / System Analyst,Астана,400000.0,,KZT,2024-12-05T08:05:33+0300,Hard Code,"Системное аналитическое мышление. Умение управлять требованиями к ПО(Вигерс, BABOK). Знание SOAP и REST API. Умение работать с БД и...",fullDay,HOURS_8,5/2,Системный аналитик,От 1 года до 3 лет,full
DevOps engineer,Алматы,,,,2024-12-15T08:17:41+0300,AVIATA.KZ,"Linux (CentOS 7, 8). Знание Ansible идемпотентность/декларатививность. Понимание инфраструктуры работы web приложений Django. Опыт работы с Docker. Оркестрация Kubernetes. ",fullDay,HOURS_8,5/2,DevOps-инженер,Нет опыта,full
PHP разработчик (Middle/Senior),Алматы,1000000.0,1600000.0,KZT,2024-11-21T20:53:49+0300,Inter Solutions,"Умение работать в команде, следовать стандартам кодирования и участвовать в код-ревью. Знание основ <highlighttext>DevOps</highlighttext> (контейнеризация, работа с Docker будет...",remote,HOURS_8,5/2,"Программист, разработчик",От 3 до 6 лет,full
Full-Stack разработчик (Node Js - React Js) (middle+),Алматы,1000000.0,,KZT,2024-12-06T09:04:30+0300,САДВАКАСОВ М. А,Имеешь опыт более 3-х лет. Интерес как фронт так и бек. Командный игрок. Будет плюсом: Опыт профилирования запросов к...,remote,HOURS_8,5/2,"Программист, разработчик",От 3 до 6 лет,full
DevOps инженер (Middle/Senior),Астана,600000.0,,KZT,2024-11-20T13:58:28+0300,Hard Code,"Отличные знания Linux (Ubuntu, Debian, CentOS) и опыт администрирования от 2-х лет. Знание принципов работы IP сетей (L2...",fullDay,HOURS_8,5/2,DevOps-инженер,От 1 года до 3 лет,full
Senior DevOps инженер,Алматы,,,,2024-12-17T09:10:04+0300,One technologies,Опыт настройки и администрирования серверов Linux/Unix. Опыт сопровождения микросервисной инфраструктуры. Управление конфигурациями Ansible. Опыт работы с Terraform. ,remote,HOURS_8,5/2,DevOps-инженер,От 3 до 6 лет,full
IOS-разработчик (middle),Алматы,,,,2024-12-06T09:03:04+0300,"Beeline, ТМ",Умение писать простой и понятный код. Будет плюсом: Знания <highlighttext>DevOps</highlighttext> (CI/CD). Опыт работы с Objective-C. Знание классических алгоритмов...,remote,HOURS_8,5/2,"Программист, разработчик",От 1 года до 3 лет,full
Team Lead - Machine Learning (Computer Vision),Алматы,250000.0,600000.0,RUR,2024-12-17T16:07:55+0300,Русецкий Максим Юрьевич,Контейнеризация и оркестрация: знание Docker и опыт работы с Kubernetes для развёртывания и управления контейнерами. <highlighttext>DevOps</highlighttext>-практики: опыт с CI...,remote,HOURS_8,5/2,Руководитель группы разработки,От 3 до 6 лет,full
Руководитель группы разработки,Астана,1500000.0,2000000.0,KZT,2024-11-20T16:01:19+0300,«Aula.kz»,"Навыки <highlighttext>DevOps</highlighttext>: Понимание принципов <highlighttext>DevOps</highlighttext>, опыт настройки CI/CD пайплайнов, автоматизации развертывания и мониторинга систем. Опыт работы с микросервисной архитектурой...",fullDay,HOURS_8,5/2,Руководитель группы разработки,Более 6 лет,full
Site Reliability Engineer (SRE),Астана,,,,2024-12-02T08:11:50+0300,Hard Code,"Опыт работы в роли SRE, <highlighttext>DevOps</highlighttext>-инженера или инженера по поддержке инфраструктуры от 2 лет. Глубокое понимание принципов мониторинга, отладки...",fullDay,HOURS_8,5/2,Другое,От 1 года до 3 лет,full
Middle DevOps,Астана,,,,2024-11-25T13:50:22+0300,Коркем Телеком,"Docker и Docker Swarm: опыт контейнеризации, управления кластерами и оптимизации контейнерных приложений.",remote,HOURS_8,5/2,DevOps-инженер,От 1 года до 3 лет,full
"Middle Software инженер (Java, My Beeline)",Алматы,,,,2024-11-21T11:23:43+0300,"Beeline, ТМ","Опыт: коммерческая разработка на Java (2+ года, Spring), уровень Middle+. ОС: Unix/Linux (желательно Linux как рабочая система). <highlighttext>DevOps</highlighttext>...",fullDay,HOURS_8,5/2,"Программист, разработчик",От 1 года до 3 лет,full
Системный администратор,Астана,,,,2024-12-03T11:51:51+0300,KazInSys,"Знание Linux (bash, systemd, ssh, базовые команды). Будет плюсом:",fullDay,HOURS_8,5/2,Системный администратор,От 3 до 6 лет,full
Системный администратор,Алматы,,,,2024-11-25T12:26:13+0300,Транспортный холдинг города Алматы,"Знание принципов работы, резервирования и восстановления баз данных Oracle, Mysql, Postgres. Знание основ <highlighttext>Devops</highlighttext> (MQ Rabbit, Docker, Nginx). ",fullDay,HOURS_8,5/2,Системный администратор,От 3 до 6 лет,full
Senior Backend Developer,Астана,,,,2024-12-15T08:51:50+0300,DauInvest,Будет плюсом: Опыт работы с Docker и Kubernetes. Знание <highlighttext>DevOps</highlighttext>-методов и инструментов (Github Actions). Понимание лучших практик обеспечения безопасности.,fullDay,HOURS_8,5/2,"Программист, разработчик",От 3 до 6 лет,full
QA Lead,Алматы,,,,2024-12-06T10:51:41+0300,International CPaaS Provider,"7+ years of experience in quality assurance, with at least 3 years in leadership roles. Strong leadership skills with...",remote,HOURS_8,5/2,Тестировщик,Более 6 лет,full
IT-рекрутер,Алматы,,,,2024-11-29T14:42:30+0300,Globerce Inc.,Какие навыки нужны? Знание IT-рынка и опыт в IT рекрутинге обязателен*. Навыки сорсинга. Коммуникабельность. Навыки интервьюирования. Организованность. ,fullDay,HOURS_8,5/2,Специалист по подбору персонала,Нет опыта,full
HR специалист,Астана,300000.0,,KZT,2024-11-18T07:51:34+0300,TEQ World,"Опыт поиска и подбора специалистов в IT-сфере от 1 года (разработка, <highlighttext>DevOps</highlighttext>, тестирование и др.). Опыт проведения интервью, оценки...",fullDay,HOURS_8,5/2,Менеджер по персоналу,От 1 года до 3 лет,full
DevOps specialist,Алматы,,,,2024-12-08T14:57:48+0300,ДиджиталБизФэктори,"Опыт работы с системами логирования (Vector, Elasticsearch/Opensearch). Приверженность лучшим практикам: <highlighttext>DevOps</highlighttext>, SRE, CI/CD, IaC. Опыт работы с инструментами...",fullDay,HOURS_8,5/2,DevOps-инженер,От 3 до 6 лет,full
MLOps Engineer,Алматы,100000.0,100000.0,RUR,2024-12-08T14:05:33+0300,ИнтеллектДиалог,"JupyterHub. MLflow. GitLab. Ansible. Apache Spark + Ray. DVC. Опыт развертывания, эксплуатации LLM моделей.",remote,HOURS_2,По выходным,Дата-сайентист,От 1 года до 3 лет,part
DevOps инженер (Ментор),Алматы,250000.0,350000.0,KZT,2024-12-03T13:29:12+0300,itcbootcamp ( айтисибууткэмп),"Хорошее знания AWS cloud(опыт администрирования не менее одногогода). Опыт работы с инструментами <highlighttext>DevOps</highlighttext> - Ansible, Terraform. Опыт работы с инструментами...",flexible,HOURS_2,5/2,DevOps-инженер,От 1 года до 3 лет,part
DevOps-инженер,Астана,,,,2024-12-05T14:10:40+0300,Intelligent Digital Solutions,"Знание CI/CD процессов на GitLab. Умение работать с базами данных PostgreSQL и аналитическими системами (ClickHouse, Kafka). Навыки настройки и...",fullDay,HOURS_8,5/2,DevOps-инженер,От 3 до 6 лет,full
Middle DevOps Engineer,Алматы,2500.0,,USD,2024-11-21T11:28:27+0300,ЧАСТНАЯ КОМПАНИЯ MD KZ LTD.,AWS Experience: Minimum 2 years of hands-on experience in commercial AWS projects. Cloud Mastery: Deep understanding of cloud concepts...,remote,HOURS_8,5/2,DevOps-инженер,От 3 до 6 лет,full
Middle/Senior DevOps,Алматы,,,,2024-11-20T12:49:54+0300,BTS Digital,Не менее пяти лет работаете с Linux и открытым ПО. Умеете автоматизировать и программировать на любом из выбранных вами языках. ,remote,HOURS_8,5/2,DevOps-инженер,От 3 до 6 лет,full
Senior Java Backend Developer (Роль – Lead разработки),Астана,,,,2024-12-15T07:43:44+0300,Platonus,"Опыт работы с Java (8+) от 5 лет. Уверенное знание Spring Framework (Spring Boot, Spring Security, Spring Data). ",fullDay,HOURS_8,5/2,Руководитель группы разработки,От 3 до 6 лет,full
Специалист по IT,Караганда,,,,2024-12-16T15:29:33+0300,itsheff.kz,Желание и умение обучаться. Умение вести диалог с клиентом. Знание операционных систем семейства Microsoft Windows. Любить людей и любить помогать. ,shift,HOURS_12,2/2,Специалист технической поддержки,От 1 года до 3 лет,full
System Engineer (DevOps),Алматы,,,,2024-12-12T13:46:07+0300,Andersen,Must-haves: - Experience as a <highlighttext>DevOps</highlighttext> Engineer for 2+ years. - Strong knowledge and experience with AWS. - Experience with Docker...,remote,HOURS_8,5/2,DevOps-инженер,От 1 года до 3 лет,full
Senior Backend Developer,Алматы,,,,2024-12-02T12:22:52+0300,BTS Digital,"Опыт работы с контейнеризацией и оркестрацией (например, Docker, Kubernetes). Знание принципов <highlighttext>DevOps</highlighttext> и опыт работы с CI/CD инструментами (например...",fullDay,HOURS_8,5/2,"Программист, разработчик",Более 6 лет,full
Team Lead Back-End,Алматы,,,,2024-11-28T15:23:46+0300,Grand era,Опыт работы с Java Spring Boot от 3-х лет. Желание развиваться как Team Lead. Развитые софт скиллы. ,fullDay,HOURS_8,5/2,Руководитель группы разработки,От 3 до 6 лет,full
Разработчик БД MS SQL Server,Алматы,,,,2024-12-17T07:43:56+0300,"ALSECO, АО","Инструментарий разработчика: Postman, Консоль разработчика браузера. Git, JIRA. Базовые навыки <highlighttext>DevOps</highlighttext> (развёртывание и настройка прикладного программного обеспечения, навыки работы в...",fullDay,HOURS_8,5/2,"Программист, разработчик",От 3 до 6 лет,full
DevOps-инженер (Senior),Астана,,,,2024-11-27T11:30:22+0300,Movavi,Опыт работы на схожей позиции от пяти лет. Уверенная работа с Git. Знание и опыт построения CI/CD Jenkins или...,remote,HOURS_8,5/2,DevOps-инженер,От 3 до 6 лет,full
Fullstack разработчик,Астана,,,,2024-12-07T14:00:02+0300,DOCUMENTOLOG CREATIVE STUDIO,"Будет плюсом: Опыт работы с микросервисной архитектурой и контейнеризированными приложениями. Знания в области <highlighttext>DevOps</highlighttext>, Kubernetes, Nginx. Навыки работы с GraphQL...",fullDay,HOURS_8,5/2,Другое,От 3 до 6 лет,full
DevOps инженер,Алматы,,,,2024-11-28T08:42:11+0300,"Beeline, ТМ","Опыт работы в области <highlighttext>DevOps</highlighttext> не менее 3 лет. Знание контейнеризации и оркестрации Docker, Kubernetes. Опыт в обслуживании и настройке...",remote,HOURS_8,5/2,DevOps-инженер,От 3 до 6 лет,full
Team Lead .NET developer (С#),Астана,1200000.0,1500000.0,KZT,2024-12-09T13:28:54+0300,Inter Solutions,"Готовность взаимодействовать с другими отделами. <highlighttext>DevOPS</highlighttext>, сетевой, ИБ и др. Знакомство с Java. Опыт разработки и проектирования систем с микросервисной...",fullDay,HOURS_8,5/2,"Программист, разработчик",От 3 до 6 лет,full
DevOps Middle Engineer,Астана,,,,2024-11-26T16:38:25+0300,Itransition,"2 + years of experience as a <highlighttext>DevOps</highlighttext>/Infrastructure Engineer. Expertise in Java, Python, Ruby, Bash or experience in another...",flexible,HOURS_8,5/2,DevOps-инженер,От 1 года до 3 лет,full
Главный архитектор Java,Алматы,,,,2024-12-02T11:43:38+0300,Мук-Компьютерс,"...сообщений (Kafka, RabbitMQ). Знание баз данных (SQL и NoSQL) и технологий кэширования (Redis, Memcached). Понимание принципов <highlighttext>DevOps</highlighttext> и практик автоматизации.",fullDay,HOURS_8,5/2,Архитектор,От 3 до 6 лет,full
Team Lead Frontend (Angular) in Uzbekistan,Алматы,,,,2024-12-06T17:27:42+0300,PAYME,"Опыт на аналогичной позиции в роли Team Lead от 2х лет. Опыт работы с Angular, TypeScript, RESTful API. ",fullDay,HOURS_8,5/2,Другое,От 3 до 6 лет,full
DevOps Engineer,Алматы,,,,2024-11-29T11:05:09+0300,Ракетная фирма,Требования к навыкам и опыту: - Уверенные навыки Shell-скриптинга (Bash). - Веб-серверы и балансировщики нагрузки (Apache \ nginx \ haproxy). - ,fullDay,HOURS_8,5/2,DevOps-инженер,От 3 до 6 лет,full
Scala developer,Алматы,6000.0,7200.0,USD,2024-12-17T13:29:28+0300,COMTEK Inc.,"Skills: - 5+ years of commercial development in Java: Microservices, Springboot. - 2+ years of commercial development in Scala (Akka...",remote,HOURS_8,5/2,"Программист, разработчик",Более 6 лет,full
Java Backend Team Lead,Алматы,,,,2024-11-28T09:42:27+0300,"Beeline, ТМ","Навык анализа кода и командной разработки (Confluence, Jira). Знание методологий разработки ПО (Agile, <highlighttext>DevOps</highlighttext> и т.п.). Опыт работы с...",fullDay,HOURS_8,5/2,Руководитель группы разработки,Более 6 лет,full
"DevOps engineer / Middle+, Senior",Алматы,800000.0,1300000.0,KZT,2024-12-17T11:32:16+0300,TRUE IT,Экспертные знания Kubernetes/OpenShift и практический опыт работы с промышленными системами. Опыт администрирования различных семейств ОС Linux. Опыт конфигурирования и...,fullDay,HOURS_8,5/2,DevOps-инженер,От 3 до 6 лет,full
"Senior Back-end Developer (Technical Lead) - Java, Kubernetes",Алматы,1500000.0,,KZT,2024-11-22T17:26:05+0300,Частная компания Global DTC Kazakhstan,"Very comfortable with modern web frameworks (e.g. Spring Boot). <highlighttext>DevOps</highlighttext> experience (e.g. Ansible, Kubernetes/Mesos) and infrastructure automation. ",fullDay,HOURS_8,5/2,"Программист, разработчик",От 3 до 6 лет,full
DevOps Engineer,Астана,,,,2024-11-20T13:12:17+0300,Новео,"Рабочие языки на проектах: английский, русский, французский. Уровень английского языка достаточный для общения с заказчиком на технические темы. ",remote,HOURS_8,5/2,"Программист, разработчик",От 3 до 6 лет,full
IT Engineer,Алматы,,,,2024-12-15T15:57:15+0300,Неткрэкер Текнолоджи Казахстан,At least 3 years of IT/<highlighttext>DevOps</highlighttext> Engineer related experience. At least 2 year of public clouds related experience. ,fullDay,HOURS_8,5/2,Системный инженер,От 3 до 6 лет,full
Software Lead Engineer (Java),Алматы,,,,2024-11-28T07:30:34+0300,"Beeline, ТМ","Навыки разработки и интеграции CI, CD, <highlighttext>DevOps</highlighttext>. Опыт управления технологическими веб-сервисами со сложной обработкой данных. Знание архитектуры высоконагруженных систем. ",fullDay,HOURS_8,5/2,Руководитель группы разработки,От 3 до 6 лет,full
Data Engineer with ML experience,Алматы,,,,2024-12-05T21:49:35+0300,"Velvetech, LLC","Expert-level design and implementation of scalable data pipelines and ETL workflows. Advanced expertise in Machine Learning, Large Language Models...",remote,HOURS_8,5/2,Дата-сайентист,Более 6 лет,full
MLops Engineer,Астана,,,,2024-12-05T21:49:51+0300,"Velvetech, LLC",Advanced MLOps pipeline implementation and optimization using MLflow and Azure Machine Learning. Expertise in developing scalable microservices for model monitoring...,remote,HOURS_8,5/2,DevOps-инженер,Более 6 лет,full
